country;risk;alternative route;explanation
Germany;Trade tensions;Netherlands;The Netherlands can serve as an alternative route due to its strong trade relationships and comparatively stable trade environment.
Germany;Economic sanctions;Belgium;Belgium can be an alternative route as it has a well-established trade network and can serve as a gateway to other European countries.
Germany;Regulatory changes;France;France can be considered as an alternative route because it has a robust regulatory system and is well-connected to other European countries.
Germany;Stock market volatility;Switzerland;Switzerland can be an alternative route as it has a stable and reliable stock market, which can mitigate the risks associated with stock market volatility.
Europe;Trade tensions;United Kingdom;The United Kingdom can serve as an alternative trade route within Europe due to its strong trade relationships and access to global markets.
Europe;Economic sanctions;Spain;Spain can be an alternative route as it has a diverse economy and can provide access to other markets within Europe and beyond.
Europe;Inflation;Italy;Italy can be considered as an alternative route as it has experience dealing with inflation and can provide stability in price levels for the supply chain.
Europe;Stock market volatility;Sweden;Sweden can be an alternative route as it has a stable stock market and a well-developed financial system, which can mitigate risks associated with stock market volatility.
